{
  "$schema": "https://json-schema.org/draft/2020-12/schema",
  "$id": "https://kujolang.ai/contracts/publishing-house/normalized-daily-packet.v1",
  "title": "publishing-house.normalized-daily-packet/v1",
  "type": "object",
  "required": [
    "contract",
    "schema_name",
    "schema_version",
    "packet_id",
    "date",
    "source_adapter",
    "items",
    "provenance"
  ],
  "properties": {
    "contract": {
      "const": "publishing-house.normalized-daily-packet/v1"
    },
    "schema_name": {
      "const": "publishing-house.normalized-daily-packet"
    },
    "schema_version": {
      "const": "1.0.0"
    },
    "packet_id": {
      "type": "string"
    },
    "date": {
      "type": "string"
    },
    "source_adapter": {
      "type": "string"
    },
    "items": {
      "type": "array",
      "minItems": 1
    },
    "provenance": {
      "type": "array"
    }
  },
  "additionalProperties": true
}
